{
 "schema_version": "1.0",
 "generated_at": "2026-10-26T06:50:21-05:00",
 "timezone": "America/Chicago",
 "edition_date": "2026-10-26",
 "visibility": "internal",
 "site": {
  "title": "Neurotech Hub Daily",
  "tagline": "Research, technology, and opportunity intelligence.",
  "hub_url": "https://neurotechhub.wustl.edu/"
 },
 "feedback": {
  "mode": "read_only",
  "instructions": "Read-only. To set a disposition (Pursue / Investigate / Monitor / Decline / Closed) or leave feedback, tell Hub - The Daily and quote the item_id."
 },
 "nav": [
  {
   "key": "news",
   "title": "News",
   "count": 12
  },
  {
   "key": "opportunity",
   "title": "Research Leads",
   "count": 12
  },
  {
   "key": "funding",
   "title": "Funded Research",
   "count": 17
  },
  {
   "key": "innovation",
   "title": "Innovation Opportunities",
   "count": 9
  },
  {
   "key": "acorn",
   "title": "Product Leads",
   "count": 8
  },
  {
   "key": "in_progress",
   "title": "In Progress",
   "count": 16
  }
 ],
 "sections": [
  {
   "key": "news",
   "title": "News",
   "source": "Hub - News Scout",
   "cadence": "Daily 3:30 AM",
   "last_refreshed": null,
   "last_run_status": "not_logged",
   "last_run_note": "No Run Health row for this bot; freshness unknown.",
   "next_run": null,
   "rows_added_last_run": null,
   "new_items_count": 12,
   "no_new_items": false,
   "visible_count": 12,
   "unavailable": false,
   "unavailable_message": null,
   "items": [
    {
     "source": "news",
     "item_id": "news:NN-20261026-002",
     "visibility": "internal",
     "title": "Tumbly: An Open-Source Home-Cage Device for Time-Restricted Feeding in Mice",
     "summary": "Preprint describing Tumbly, a battery-powered, servo-driven food hopper that gates diet access on a user-set schedule and fits multiple vivarium cage types via a swappable faceplate; design files are open. Validation in two labs reported no device failures over >1000 hours and normal body weight and intake under 8-h TRF.",
     "category": "Open Source",
     "subcategory": null,
     "date_published": "2026-10-24",
     "date_discovered": "2026-10-26T05:45-05:00",
     "date_updated": "2026-10-26T05:45-05:00",
     "is_new": true,
     "link": "https://www.biorxiv.org/content/10.64898/2026.10.19.760239v1",
     "secondary_links": [
      "https://doi.org/10.64898/2026.10.19.760239"
     ],
     "confidence": "high",
     "score": 90,
     "score_original": {
      "value": "90",
      "scale": "0-100",
      "label": "relevance"
     },
     "disposition": "New",
     "matt_feedback": null,
     "next_review_date": null,
     "atlas_ids": [],
     "related_items": [],
     "product_matches": [
      {
       "product_id": "PRD-002",
       "name": "Body Event Analysis Module 3 (BEAM3)",
       "store_url": "https://neurotechhub.wustl.edu/store/",
       "github_url": "https://github.com/Neurotech-Hub/Hublink-BEAM"
      },
      {
       "product_id": "PRD-003",
       "name": "Hub Wheel with Hublink",
       "store_url": "https://neurotechhub.wustl.edu/store/",
       "github_url": "https://github.com/Neurotech-Hub/WheelLogger_ULP-Arduino"
      },
      {
       "product_id": "PRD-007",
       "name": "FlightCap Lick and Liquid Sensor",
       "store_url": "https://neurotechhub.wustl.edu/store/",
       "github_url": "https://github.com/Neurotech-Hub/FlightCap"
      },
      {
       "product_id": "PRD-009",
       "name": "Two-bottle Sipper Hub",
       "store_url": "https://neurotechhub.wustl.edu/store/",
       "github_url": null
      },
      {
       "product_id": "PRD-010",
       "name": "Hublink",
       "store_url": null,
       "github_url": "https://github.com/Neurotech-Hub/HubLink-Server"
      }
     ],
     "people": [],
     "details": {
      "publisher": "bioRxiv",
      "hub_relevance": "Directly overlaps the Hub's automated feeding, circadian, and battery-powered home-cage device lines and could pair with Hublink-style cloud logging.",
      "related_assets_raw": "Hub Wheel with Hublink; FlightCap Lick and Liquid Sensor; Two-bottle Sipper Hub; BEAM3",
      "evidence_type": "Preprint",
      "doi": "10.64898/2026.10.19.760239",
      "pmid": null,
      "bot_status": "new",
      "review_notes": null
     },
     "source_record": {
      "sheet_url": "https://docs.google.com/spreadsheets/d/16n6jMn_t4l2zRZjES3BlAnXsIbXcZlHz-a8l4usQEdQ/edit",
      "tab": "News_Log",
      "row": 3,
      "record_id": "NN-20261026-002"
     },
     "feedback_instructions": "Read-only. To set a disposition (Pursue / Investigate / Monitor / Decline / Closed) or leave feedback, tell Hub - The Daily and quote the item_id."
    },
    {
     "source": "news",
     "item_id": "news:NN-20261026-001",
     "visibility": "internal",
     "title": "Cortex-wide imaging in naturally behaving mice with 1-gram wireless mesoscopes (Airscope)",
     "summary": "Tsinghua University researchers report Airscope, a fully wireless ~1 g head-mounted mesoscope (including battery) with a ~6 mm field of view that streams cortex-wide calcium imaging over Wi-Fi from freely behaving mice. The paper reports recording more than 8,500 neurons per mouse and simultaneous multi-animal recording.",
     "category": "Scientific Hardware",
     "subcategory": null,
     "date_published": "2026-10-19",
     "date_discovered": "2026-10-26T05:45-05:00",
     "date_updated": "2026-10-26T05:45-05:00",
     "is_new": true,
     "link": "https://www.nature.com/articles/s41586-026-11293-x",
     "secondary_links": [
      "https://doi.org/10.1038/s41586-026-11293-x"
     ],
     "confidence": "high",
     "score": 88,
     "score_original": {
      "value": "88",
      "scale": "0-100",
      "label": "relevance"
     },
     "disposition": "New",
     "matt_feedback": null,
     "next_review_date": null,
     "atlas_ids": [],
     "related_items": [],
     "product_matches": [
      {
       "product_id": "PRD-002",
       "name": "Body Event Analysis Module 3 (BEAM3)",
       "store_url": "https://neurotechhub.wustl.edu/store/",
       "github_url": "https://github.com/Neurotech-Hub/Hublink-BEAM"
      },
      {
       "product_id": "PRD-006",
       "name": "Juxta Social Proximity Loggers (Gen5)",
       "store_url": "https://neurotechhub.wustl.edu/store/",
       "github_url": "https://github.com/Neurotech-Hub/Juxta5-nRF"
      },
      {
       "product_id": "PRD-010",
       "name": "Hublink",
       "store_url": null,
       "github_url": "https://github.com/Neurotech-Hub/HubLink-Server"
      }
     ],
     "people": [],
     "details": {
      "publisher": "Nature",
      "hub_relevance": "Battery-powered wireless head-mounted recording in freely moving, socially housed mice parallels the Hub's low-power wireless wearable work (Juxta, BEAM3) and its optical instrumentation interests.",
      "related_assets_raw": "Juxta Social Proximity Loggers; BEAM3; Hublink",
      "evidence_type": "Peer-reviewed",
      "doi": "10.1038/s41586-026-11293-x",
      "pmid": null,
      "bot_status": "new",
      "review_notes": null
     },
     "source_record": {
      "sheet_url": "https://docs.google.com/spreadsheets/d/16n6jMn_t4l2zRZjES3BlAnXsIbXcZlHz-a8l4usQEdQ/edit",
      "tab": "News_Log",
      "row": 2,
      "record_id": "NN-20261026-001"
     },
     "feedback_instructions": "Read-only. To set a disposition (Pursue / Investigate / Monitor / Decline / Closed) or leave feedback, tell Hub - The Daily and quote the item_id."
    },
    {
     "source": "news",
     "item_id": "news:NN-20261026-003",
     "visibility": "internal",
     "title": "Camus: a video-based framework for continuous behavioral monitoring in the mouse home-cage",
     "summary": "Preprint presenting Camus, an open-source home-cage video system using off-the-shelf USB cameras, IR illumination, and 3D-printed parts with a validated computer-vision model for locomotion, feeding, drinking, and nesting. One desktop records up to 20 cages at ~$250 incremental cost per cage and captured circadian structure and 5xFAD nesting deficits.",
     "category": "Open Source",
     "subcategory": null,
     "date_published": "2026-10-24",
     "date_discovered": "2026-10-26T05:45-05:00",
     "date_updated": "2026-10-26T05:45-05:00",
     "is_new": true,
     "link": "https://www.biorxiv.org/content/10.64898/2026.10.23.761437v1",
     "secondary_links": [
      "https://doi.org/10.64898/2026.10.23.761437"
     ],
     "confidence": "high",
     "score": 86,
     "score_original": {
      "value": "86",
      "scale": "0-100",
      "label": "relevance"
     },
     "disposition": "New",
     "matt_feedback": null,
     "next_review_date": null,
     "atlas_ids": [],
     "related_items": [],
     "product_matches": [
      {
       "product_id": "PRD-002",
       "name": "Body Event Analysis Module 3 (BEAM3)",
       "store_url": "https://neurotechhub.wustl.edu/store/",
       "github_url": "https://github.com/Neurotech-Hub/Hublink-BEAM"
      },
      {
       "product_id": "PRD-003",
       "name": "Hub Wheel with Hublink",
       "store_url": "https://neurotechhub.wustl.edu/store/",
       "github_url": "https://github.com/Neurotech-Hub/WheelLogger_ULP-Arduino"
      },
      {
       "product_id": "PRD-007",
       "name": "FlightCap Lick and Liquid Sensor",
       "store_url": "https://neurotechhub.wustl.edu/store/",
       "github_url": "https://github.com/Neurotech-Hub/FlightCap"
      },
      {
       "product_id": "PRD-010",
       "name": "Hublink",
       "store_url": null,
       "github_url": "https://github.com/Neurotech-Hub/HubLink-Server"
      }
     ],
     "people": [],
     "details": {
      "publisher": "bioRxiv",
      "hub_relevance": "Provides a low-cost video ground truth for the same circadian home-cage behaviors the Hub measures with BEAM3, Hub Wheel, and FlightCap sensors.",
      "related_assets_raw": "BEAM3; Hub Wheel with Hublink; FlightCap Lick and Liquid Sensor",
      "evidence_type": "Preprint",